{
  "schemaVersion": 2,
  "toolId": "grid.tool.fixture",
  "availability": "Available",
  "status": "Collected",
  "workspaceId": "workspace.transplanted",
  "requestId": "request.fixture",
  "submissionId": "submission.fixture",
  "envelopeSha256": "AAAAAAAAAAAAAAAAAAAAAAAAAAAAAAAAAAAAAAAAAAAAAAAAAAAAAAAAAAAAAAAA",
  "planSha256": "BBBBBBBBBBBBBBBBBBBBBBBBBBBBBBBBBBBBBBBBBBBBBBBBBBBBBBBBBBBBBBBB",
  "authorizationGrantId": "grant-0123456789abcdef0123456789abcdef",
  "authorizationBindingSha256": "0424313F60647E1457515323FC2824CE5E12B1B7CE4AD84765CC3F58AA377C97",
  "capabilityId": "grid.health.fixture",
  "capabilityVersion": "2.0.0",
  "adapterId": "FixtureAdapter",
  "adapterVersion": "1",
  "normalizedInputSha256": "EEEEEEEEEEEEEEEEEEEEEEEEEEEEEEEEEEEEEEEEEEEEEEEEEEEEEEEEEEEEEEEE",
  "outputSha256": "1111111111111111111111111111111111111111111111111111111111111111",
  "evidenceSha256": "2222222222222222222222222222222222222222222222222222222222222222",
  "startedAt": "2026-09-02T20:00:00Z",
  "completedAt": "2026-09-02T20:00:01Z",
  "durationMilliseconds": 1000,
  "exitCode": 0,
  "reason": null,
  "stdout": "fixture",
  "stderr": "",
  "evidence": [],
  "receiptSha256": "3333333333333333333333333333333333333333333333333333333333333333"
}
